{
  "action": "direct",
  "status": "APPROVED",
  "direction": "INTERNAL",
  "amount": "1000",
  "assetCode": "USDC",
  "chartOfAccountsGroupName": "CARD_PURCHASES",
  "scheme": "CARD",
  "groupId": "0199c3a6-9d43-7b5e-9f70-8c9d0e1f2a00",
  "createdAt": "2026-10-09T15:00:00Z",
  "operations": [
    {
      "id": "0199c3a6-9d43-7b5e-9f70-8c9d0e1f2a01",
      "type": "DEBIT",
      "amount": "1000",
      "assetCode": "USDC",
      "chartOfAccounts": "1102",
      "accountId": "0199c3a6-0001-7000-8000-0000000000a3",
      "external": false,
      "feeLeg": false
    },
    {
      "id": "0199c3a6-9d43-7b5e-9f70-8c9d0e1f2a02",
      "type": "CREDIT",
      "amount": "985",
      "assetCode": "USDC",
      "chartOfAccounts": "2102",
      "accountId": "0199c3a6-0001-7000-8000-0000000000a4",
      "external": false,
      "feeLeg": false
    },
    {
      "id": "0199c3a6-9d43-7b5e-9f70-8c9d0e1f2a03",
      "type": "CREDIT",
      "amount": "15",
      "assetCode": "USDC",
      "chartOfAccounts": "4101",
      "accountId": "0199c3a6-0001-7000-8000-0000000000f1",
      "external": false,
      "feeLeg": true
    }
  ]
}
